{
  "schema_version": 1,
  "dependency": "Wasmtime Cranelift C API",
  "version": "v45.0.0",
  "platform": "Android",
  "architecture": "arm64",
  "release_url": "https://github.com/bytecodealliance/wasmtime/releases/tag/v45.0.0",
  "archive": {
    "name": "wasmtime-v45.0.0-aarch64-android-c-api.tar.xz",
    "url": "https://github.com/bytecodealliance/wasmtime/releases/download/v45.0.0/wasmtime-v45.0.0-aarch64-android-c-api.tar.xz",
    "size_bytes": 13413296,
    "sha256": "af5160bb3975686aec2f2ae1494bcd7ed4adcd3d4922af23e16bea3b687bfc1b",
    "root": "wasmtime-v45.0.0-aarch64-android-c-api"
  },
  "layout": {
    "include_relative_path": "include",
    "static_library_relative_path": "lib/libwasmtime.a",
    "static_library_sha256": "d53dd5a687cc555b1a8b77c4639bfc355812000b7987c4a0f559982e61e75b28",
    "license_relative_path": "LICENSE"
  },
  "install": {
    "relative_path": "Source/ThirdParty/Wasmtime/installed/Android/arm64/v45.0.0",
    "managed_marker_name": ".avidscript-wasmtime-managed.json"
  },
  "license": {
    "expression": "Apache-2.0 WITH LLVM-exception",
    "tracked_file": "Source/ThirdParty/Wasmtime/LICENSE.txt"
  }
}
